Condition,Drug Name,Review
Depression,Prozac,"I've been taking Prozac for a few years now, and while it’s helped with my depression, I’ve noticed a few things. For one, it seems like the longer I’m on it, the more I depend on it. My doctor warned me that Prozac can become addictive if not managed properly. I definitely feel like I need it to function normally, and sometimes I worry about what would happen if I missed a dose."
Depression,Zoloft,"Zoloft has been a game-changer for me in managing my depression, but I’ve also learned that it can be somewhat habit-forming. The need to take it every day and the anxiety about running out of pills makes me feel like I’m dependent on it. My therapist explained that while it’s not physically addictive like some substances, the psychological reliance can still be strong."
Depression,Paxil,"Paxil has helped stabilize my mood significantly, but I’ve noticed that stopping it or missing a dose can make me feel off. It’s almost like my body has gotten used to it and relies on it to feel normal. I’ve been cautious about not skipping doses and have talked to my doctor about the potential for developing a dependency."
Depression,Lexapro,"Lexapro has really helped me cope with my depression, but there’s a part of me that worries about how dependent I’ve become on it. I find myself anxious if I don’t have a refill on hand. My doctor reassured me that Lexapro is less likely to be addictive, but I still feel a psychological attachment to it."
Depression,Wellbutrin,"Wellbutrin has been effective for my depression, and it’s nice that it doesn’t have some of the side effects of other antidepressants. However, I do find that I have a strong psychological dependence on it. I’ve gotten used to taking it daily, and sometimes I worry about what might happen if I ever had to stop taking it."
Depression,Cymbalta,"Taking Cymbalta has been a positive experience for my depression, but I’ve also noticed that I feel a sense of dependency on it. It’s almost like a part of my routine now, and I’m concerned about how I would cope if I had to stop. My doctor has mentioned that while it can be effective, it’s important to manage it carefully to avoid any issues with addiction."
Depression,Effexor,"Effexor has been instrumental in helping me manage my depression, but I’ve experienced a strong psychological dependency on it. Missing a dose or thinking about going off it causes me a lot of anxiety. I’ve discussed these concerns with my doctor, who has explained that while it’s not physically addictive, the mental reliance can be significant."
Depression,Celexa,"Celexa has improved my mood significantly, but I’ve noticed that I have a tendency to rely on it quite a bit. It’s become a crucial part of my daily routine, and the thought of missing a dose or stopping it is quite unsettling. My healthcare provider has assured me that it’s not addictive, but I still feel a psychological attachment."
Depression,Remeron,"Remeron has been helpful for my depression, but there’s a part of me that worries about how dependent I’ve become on it. It seems like I’m always thinking about making sure I have enough medication and what might happen if I run out. I’ve talked to my doctor about this, and they’ve advised me on managing it effectively to avoid dependency issues."
Depression,Viibryd,"Viibryd has been effective for my depression, but I do feel a strong reliance on it. The thought of missing a dose or stopping it is quite anxiety-inducing. I’ve spoken with my doctor about these concerns, and while they’ve assured me that Viibryd is not physically addictive, the psychological aspect can still be significant."
Anxiety,Xanax,"Xanax has been a lifesaver for my anxiety, but I’ve also realized that it can be quite addictive. I often find myself feeling anxious about running out of pills and needing to take them more frequently. My doctor has warned me about the potential for addiction and the importance of using Xanax as directed."
Anxiety,Ativan,"Ativan has been very effective in managing my anxiety, but I’ve also become quite reliant on it. The idea of not having it or missing a dose causes a lot of stress for me. I’ve discussed my concerns with my doctor, who has emphasized the importance of not overusing Ativan to avoid dependency."
Anxiety,Klonopin,"Klonopin has helped me with my anxiety, but I’ve found that I have a strong psychological dependence on it. I feel like I need it to manage my daily life and am worried about what might happen if I don’t have it. My doctor has explained that while Klonopin can be helpful, it’s crucial to use it carefully to avoid addiction."
Anxiety,Valium,"Valium has been effective for my anxiety, but I’ve noticed that I rely on it quite a bit. I often feel anxious about running out and find myself needing to take it regularly. I’ve talked to my healthcare provider about this, and they’ve advised me on how to use Valium responsibly to prevent addiction."
Anxiety,Buspar,"Buspar has helped with my anxiety without some of the addictive potential of other medications. However, I still find myself becoming somewhat reliant on it. It’s reassuring that Buspar is less likely to be physically addictive, but I still feel a psychological dependence on it."
Anxiety,Librium,"Librium has been helpful for managing my anxiety, but I’ve realized that I have a tendency to depend on it. I’m concerned about the possibility of becoming addicted and have discussed these worries with my doctor. They’ve advised me on proper usage to minimize addiction risk."
Anxiety,Vistaril,"Vistaril has been effective in managing my anxiety, but I’ve noticed that I feel a strong psychological reliance on it. The thought of missing a dose or running out of it makes me anxious. My healthcare provider has discussed the importance of using Vistaril as prescribed to avoid dependency issues."
Anxiety,Seroquel,"Seroquel has been helpful for my anxiety, but I’ve noticed that I have a significant psychological dependence on it. I feel like I need it to manage my symptoms and often worry about running out. My doctor has advised me on how to use Seroquel responsibly to avoid addiction."
Pain Management,Oxycodone,"Oxycodone has been very effective for managing my pain, but I’ve come to realize that it can be highly addictive. I’m often worried about running out and find myself needing it more frequently. My doctor has discussed the risks of addiction with me and has recommended careful monitoring."
Pain Management,Hydrocodone,"Hydrocodone has helped me manage my pain, but I’ve noticed a strong psychological reliance on it. I often feel anxious about not having enough and find myself needing it more as time goes on. My healthcare provider has emphasized the importance of using it cautiously to prevent addiction."
Pain Management,Morphine,"Morphine has been effective for severe pain, but I’ve become quite dependent on it. The thought of running out or needing to stop is very distressing. My doctor has warned me about the high risk of addiction and has advised me on proper usage."
Pain Management,Fentanyl,"Fentanyl has been highly effective for pain management, but it is also very addictive. I find myself needing it regularly and feel anxious about running out. My healthcare provider has stressed the importance of using Fentanyl under strict supervision to avoid addiction."
Pain Management,Codeine,"Codeine has helped with my pain, but I’ve developed a psychological dependence on it. I worry about running out and often feel the need to take it more frequently. My doctor has explained the risks of addiction and advised me on managing its use."
Pain Management,Percocet,"Percocet has been very effective for pain relief, but I’ve noticed a strong reliance on it. I often feel anxious about running out and need to take it regularly. My healthcare provider has discussed the potential for addiction and how to use it responsibly."
Pain Management,Dilaudid,"Dilaudid has been effective for severe pain, but I’ve become quite dependent on it. The thought of not having it or needing to stop is distressing. My doctor has emphasized the importance of monitoring its use to avoid addiction."
Pain Management,Tramadol,"Tramadol has been helpful for pain management, but I find myself relying on it more than I expected. I feel anxious about running out and often need it more frequently. My healthcare provider has discussed the risk of addiction and advised me on proper use."
Pain Management,Methadone,"Methadone has been effective for managing chronic pain, but it’s also quite addictive. I find myself needing it regularly and feel anxious about running out. My doctor has warned me about the risk of addiction and has provided guidance on its use."
Hypertension,Lisinopril,"Lisinopril has been great for managing my blood pressure, and I haven’t experienced any issues with addiction. It’s been a stable part of my routine, and I feel reassured that it doesn’t cause dependency. My doctor has explained that it’s a safe medication with minimal risk of addiction."
Hypertension,Losartan,"Losartan has been effective in controlling my blood pressure without causing any addiction issues. It’s become a normal part of my daily routine, and I don’t feel any psychological dependence on it. My healthcare provider has confirmed that it’s not habit-forming."
Hypertension,Atenolol,"Atenolol has been working well for my hypertension, and I haven’t noticed any addiction problems. It’s reassuring to know that it doesn’t lead to dependency. My doctor has confirmed that it’s a safe medication with no risk of addiction."
Hypertension,Metoprolol,"Metoprolol has been effective in lowering my blood pressure, and I haven’t experienced any issues with addiction. It’s part of my daily routine, and I don’t feel any psychological attachment to it. My healthcare provider has assured me that it’s a safe option."
Hypertension,Amlodipine,"Amlodipine has helped control my blood pressure without any risk of addiction. It’s become a regular part of my routine, and I don’t feel any dependence on it. My doctor has explained that it’s a safe medication with no addictive properties."
Hypertension,Norvasc,"Norvasc has been great for managing my hypertension without any risk of addiction. It’s part of my daily routine, and I feel reassured that it doesn’t cause dependency. My healthcare provider has confirmed that it’s safe and not habit-forming."
